judge,venue,type,description,evidence,type_norm
gemini-3.1-pro-preview,iclr2025_bi_align,Hallucinated Methodology,"The paper discusses 'receptivity prediction' as a component of the model and claims in the ablation studies that 'receptivity prediction provides essentially no benefit (∆=-0.01)', concluding that 'sophisticated user modeling may be unnecessary'. However, in the provided code, the `receptivity_predictor` module is dead code. It is initialized in the `CCDModel` but never used in the forward pass, strategy selection, or loss calculation. The ablation simply removes this unused module, making the conclusion about user modeling entirely hallucinated.","Paper: ""Surprisingly, receptivity prediction provides essentially no benefit (∆=-0.01)... The minimal contribution of receptivity prediction indicates that sophisticated user modeling may be unnecessary""
Code: `self.receptivity_predictor` is defined in `__init__` but `forward(self, x)` only returns `self.strategy_net(x)`. It is never used in the training loop.",Hallucinated Methodology
gemini-3.1-pro-preview,iclr2025_bi_align,Faked Experimental Results,"The paper reports the absolute CDES scores for the network depth ablation as 0.947 (deep) and 0.917 (shallow). While the delta (+0.03) matches the experiment, the actual absolute scores from the ablation run were 0.9339 (deep) and 0.9026 (shallow). The paper incorrectly reused the main experiment's overall CDES score (0.947) for the deep model in this specific ablation.","Paper: ""Network depth has minimal impact (deep: 0.947 CDES, shallow: 0.917 CDES).""
Code/Logs: Deep Model Evaluation CDES Score: 0.9339, Shallow Model Evaluation CDES Score: 0.9026.",Faked Experimental Results
gemini-3.1-pro-preview,iclr2025_buildingtrust,Nonexistent Citations,The paper cites a nonexistent paper by Glenn Zhang et al. with an impossible future arXiv ID (2512.11998). The authors and the arXiv ID are fabricated.,"Glenn Zhang, Treasure Mayowa, Jason Fan, Yicheng Fu, Aaron Sandoval, Sean O’Brien, and Kevin Zhu. Direct confidence alignment: Aligning verbalized confidence with internal confidence in large language models. ArXiv, abs/2512.11998, 2025.",Nonexistent Citations
gemini-3.1-pro-preview,iclr2025_buildingtrust,Nonexistent Citations,The paper cites a paper by Neil Rathi et al. with an impossible future arXiv ID (2507.06306).,"Neil Rathi, Dan Jurafsky, and Kaitlyn Zhou. Humans overrely on overconfident language models, across languages. ArXiv, abs/2507.06306, 2025.",Nonexistent Citations
gemini-3.1-pro-preview,iclr2025_buildingtrust,Faked Experimental Results,"The paper claims that top_p=0.85 achieves the lowest training loss. However, the experimental data and analysis explicitly state that top_p=0.9 achieves the lowest training loss (~2.55), while top_p=0.85 degrades by epoch 4 (loss rises to ~3.67).","Figure 5 shows a critical dissociation: top p=0.85 achieves the lowest training loss but produces the worst validation alignment, collapsing to negative values.",Faked Experimental Results
gemini-3.1-pro-preview,iclr2025_buildingtrust,Mathematical Errors,"The paper claims that temperature is annealed from 0.9 to 0.5 over 8 epochs. However, the code implements `temp = 0.9 - epoch * 0.05` for 8 epochs (epoch 0 to 7), which results in a final temperature of 0.55, not 0.5.",temperature annealing from 0.9 to 0.5 over 8 epochs,Mathematical Errors
gemini-3.1-pro-preview,iclr2025_buildingtrust,Hallucinated Methodology,"The paper claims the Synthetic QA dataset contains 500 questions across 5 difficulty levels. However, the code generates only 75 questions (55 for training, 20 for validation) using 13 templates with 10 distinct difficulty levels.",The Synthetic QA dataset contains 500 questions across 5 difficulty levels.,Hallucinated Methodology
gemini-3.1-pro-preview,iclr2025_buildingtrust,Hallucinated Methodology,"The paper claims that TriviaQA, CommonsenseQA, and SciQ each contribute 200 sampled questions for evaluation. However, the code only loads 30 questions for each of these datasets.","TriviaQA (Joshi et al., 2017), CommonsenseQA (Talmor et al., 2019), and SciQ each contribute 200 sampled questions for evaluation.",Hallucinated Methodology
gemini-3.1-pro-preview,iclr2025_buildingtrust,Hallucinated Methodology,"The paper claims the hedging patterns are organized into three tiers with weights 0.9, 0.5, and -0.3. However, the code implements 10 tiers of hedging patterns with weights ranging from 0.95 to 0.05.","Hedging patterns are organized into three tiers: high-hedge (weight 0.9: “I’m not sure,” “maybe”), medium-hedge (weight 0.5: “I think,” “probably”), and certainty markers (weight -0.3: “definitely,” “certainly”).",Hallucinated Methodology
gemini-3.1-pro-preview,iclr2025_data_problems,Faked Experimental Results,The paper fabricates the validation loss numbers for the AG News and IMDB datasets in the main results section. The reported numbers do not match the actual experimental data logged in the code.,"Paper claims: ""AG News shows similar patterns (PADA: 1.698, Random: 1.695, Full: 1.672), as does IMDB (PADA: 1.674, Random: 1.671, Full: 1.648)."" However, the actual metrics from the code are: AG News (PADA: 1.7228, Random: 1.7344, Full: 1.664) and IMDB (PADA: 1.5509, Random: 1.5557, Full: 1.491).",Faked Experimental Results
gemini-3.1-pro-preview,iclr2025_data_problems,Faked Experimental Results,"The paper fabricates the ablation study result for the 'Positional Scaling' component. It claims that removing positional scaling results in an average validation loss of 1.698, but the actual experimental data shows a much lower average validation loss.","Table 1 in the paper claims the average final validation loss without Positional Scaling is 1.698. However, the data from the 'No Positional Encoding Scaling' ablation shows validation losses of 1.7169 (WikiText), 1.6351 (AG News), and 1.4735 (IMDB), which average to 1.6085.",Faked Experimental Results
gemini-3.1-pro-preview,iclr2025_data_problems,Hallucinated Methodology,The paper incorrectly reports the total number of parameters for the SmallTransformer model used in the experiments.,"The paper claims in Section D: ""Total parameters: approximately 2.1M."" However, based on the architecture defined in the code (`vocab_size=256`, `d_model=192`, `nhead=6`, `num_layers=4`, `dim_ff=512`), the actual parameter count is approximately 1.53M (Embedding: ~49K, Positional Encoding: ~49K, 4 Transformer Layers: ~1.38M, Output Linear: ~49K).",Hallucinated Methodology
gemini-3.1-pro-preview,iclr2025_dl4c,Faked Experimental Results,"The paper claims to evaluate the model's cross-dataset generalization on real-world datasets (CodeXGLUE, MBPP, and HumanEval), presenting results in Table 1 and stating that the model 'generalizes well across different code distributions.' However, the provided code reveals that the model is never actually evaluated on these datasets. The code loads the HuggingFace datasets but completely ignores them, instead generating additional synthetic data using the exact same 4 hardcoded program templates used for training (via the `generate_dataset` function with different random seeds) and misleadingly naming the variables `codexglue_test`, `mbpp_test`, and `humaneval_test`. Therefore, the cross-dataset generalization results are entirely fabricated.","Paper claims: 'DAPR achieves 96.7% test accuracy with strong cross-dataset generalization (Table 1).' Code shows: 'codexglue_test = generate_dataset(num_samples=500, seed_offset=100)\nmbpp_test = generate_dataset(num_samples=500, seed_offset=200)\nhumaneval_test = generate_dataset(num_samples=500, seed_offset=300)' where `generate_dataset` uses the same synthetic templates as the training data.",Faked Experimental Results
gemini-3.1-pro-preview,iclr2025_mldpr,Faked Experimental Results,"The paper claims to have computed the correlation between documentation debt and cross-seed variance, reporting specific statistical values (Spearman ρ = -0.036, p = 0.899). However, the provided source code never computes this correlation. While the code calculates the variance across seeds, it does not perform any correlation analysis between the debt scores and these variances. The reported ρ and p-values are entirely fabricated to support a qualitative observation.","We also find no significant correlation between documentation debt and cross-seed variance (Spearman ρ = -0.036, p = 0.899), indicating documentation debt predicts average failure rates but not training instability.",Faked Experimental Results
gemini-3.1-pro-preview,iclr2025_question,Hallucinated Methodology,"The paper claims the probe is a two-layer MLP with dimensions 768 -> 256 -> 4. However, the code implements a three-layer MLP with dimensions 768 -> 256 -> 128 -> 4.","Paper: ""The probe is a two-layer MLP (768 -> 256 -> 4)""
Code: 
self.network = nn.Sequential(
    nn.Linear(input_dim, hidden_dim),
    ...
    nn.Linear(hidden_dim, hidden_dim // 2),
    ...
    nn.Linear(hidden_dim // 2, num_classes),
)",Hallucinated Methodology
gemini-3.1-pro-preview,iclr2025_question,Faked Experimental Results,"In Table 1, the paper reports the TF-IDF Features baseline as having an ECE of 0.120 and Routing Precision of 0.970. However, the actual experiment logs for the TF-IDF ablation (`no_distilgpt2_embeddings`) show an ECE of 0.0953 and Routing Precision of 0.9582.","Paper Table 1: ""TF-IDF Features | 0.927 | 0.120 | 0.970""
Experiment JSON (`no_distilgpt2_embeddings`): ""Expected Calibration Error (ECE)"" final_value: 0.0953, ""Routing Precision"" final_value: 0.9582.",Faked Experimental Results
gemini-3.1-pro-preview,iclr2025_question,Nonexistent Citations,The paper cites two papers with fabricated arXiv IDs from the future (April and June 2025): 'abs/2504.14154' and 'abs/2506.09669'.,"Zhiyuan Wang et al. Sconu: Selective conformal uncertainty in large language models. ArXiv, abs/2504.14154, 2025.
Lihu Chen and G. Varoquaux. Query-level uncertainty in large language models. ArXiv, abs/2506.09669, 2025.",Nonexistent Citations
gemini-3.1-pro-preview,iclr2025_scope,Mathematical Errors,"The paper's mathematical formulation for the ground-truth importance score incorrectly states that it sums only over future positions (t > i) and divides by (T - i). However, the code uses a bidirectional model (DistilBERT) and sums the attention weights over all query positions without dividing by (T - i). Additionally, the equation omits the max-normalization step that is present in the code.","Paper: ""y_i = \frac{1}{H \cdot (T-i)} \sum_{h=1}^H \sum_{t>i} \alpha_{t,i}^{(h)}""
Code: ""importance = avg_attn.sum(dim=1)\nimportance = importance / (importance.max(dim=-1, keepdim=True)[0] + 1e-8)""",Mathematical Errors
gemini-3.1-pro-preview,iclr2025_scope,Hallucinated Methodology,"The paper claims that the ground-truth importance is computed exclusively from DistilBERT's final layer attention weights. However, the code averages the attention weights across all layers of the model.","Paper: ""Ground-truth importance is computed from DistilBERT’s final layer attention weights...""
Code: ""all_attn = torch.stack(attention_weights, dim=0)\navg_attn = all_attn.mean(dim=(0, 2))""",Hallucinated Methodology
gemini-3.1-pro-preview,iclr2025_scope,Hallucinated Methodology,"The paper incorrectly reports the dropout rate and the number of pairs sampled for the ranking loss. It claims a dropout rate of 0.1 and 64 pairs per sequence, whereas the code uses a dropout rate of 0.2 and samples up to 100 pairs.","Paper: ""dropout rate 0.1"" and ""we sample 64 pairs per sequence.""
Code: ""nn.Dropout(0.2)"" and ""n_pairs = min(100, seq_len * (seq_len - 1) // 2)""",Hallucinated Methodology
gemini-3.1-pro-preview,iclr2025_scsl,Faked Experimental Results,"The paper claims that the standard deviation-based threshold method for neuron classification failed entirely, resulting in 0.00 separation. However, the experimental results from the ablation study 'Adaptive Threshold-Based vs Fixed K-Means Clustering for Neuron Classification' show that mean-std variants yielded a sizable separation of ~1.8-3.1.","Threshold-based methods (percentile, standard deviation, median) show lower and more variable performance, with the standard deviation method failing entirely (0.00 separation) due to the non-Gaussian distribution of velocity signatures.",Faked Experimental Results
gemini-3.1-pro-preview,iclr2025_scsl,Nonexistent Citations,"The paper cites a paper by Daniel Kunin et al. with the arXiv ID `abs/2506.06489` and year 2025. The arXiv ID `2506.06489` corresponds to June 2025, which is in the future, making this a hallucinated arXiv identifier.","Daniel Kunin, G. Marchetti, Feng Chen, Dhruva Karkada, James B. Simon, M. R. DeWeese, Surya Ganguli, and N. Miolane. Alternating gradient flows: A theory of feature learning in two-layer neural networks. ArXiv, abs/2506.06489, 2025.",Nonexistent Citations
gemini-3.1-pro-preview,iclr2025_verifai,Faked Experimental Results,"The main results comparing the baseline and ETCL validation accuracies are fabricated. The paper claims specific accuracy numbers for both models that do not match the actual experimental data. For example, the paper claims the baseline achieved 84.8% on GSM8K, 85.5% on SciQ, and 87.5% on WinoGrande, while ETCL achieved 84.3%, 83.3%, and 87.5% respectively. However, the aggregated results from the experiments show the baseline achieved 86.3% on GSM8K, 85.3% on SciQ, and 87.1% on WinoGrande, while ETCL achieved 85.3%, 83.8%, and 85.9%.","Main Results. Figure 1 presents the primary comparison. On synthetic data, both methods achieve perfect accuracy. However, on real datasets, the baseline consistently outperforms ETCL: GSM8K (84.8% vs 84.3%), SciQ (85.5% vs 83.3%), and WinoGrande (87.5% vs 87.5%).",Faked Experimental Results
gemini-3.1-pro-preview,iclr2025_verifai,Faked Experimental Results,"The generalization gaps reported in the paper are hallucinated. The paper claims ETCL exhibits negative gaps between -0.25 and -0.4, and the baseline shows positive gaps between 0.15 and 0.2. In reality, the experimental data shows ETCL's gaps on real datasets are between -0.07 and -0.11, and the baseline's gaps are much larger, ranging from 0.40 to 0.45.",The generalization gap analysis reveals a counterintuitive pattern: ETCL exhibits negative gaps ( − 0.25 to − 0.4) while baseline shows positive gaps (0.15–0.2).,Faked Experimental Results
gemini-3.1-pro-preview,iclr2025_verifai,Faked Experimental Results,"In Table 1, the individual dataset results for the Curriculum ablation are hallucinated. The paper claims the curriculum component had an impact of -0.5% on GSM8K, -0.3% on SciQ, and -0.8% on WinoGrande. However, the actual experimental data for the 'No Curriculum Learning' ablation shows the impact was -1.25% on GSM8K, 0.0% on SciQ, and -0.25% on WinoGrande.",Table 1: Ablation study: accuracy impact (with component − without). [...] Curriculum -0.5% -0.3% -0.8% -0.5%,Faked Experimental Results
gemini-3.1-pro-preview,iclr2025_wsl,Faked Experimental Results,"The paper claims that removing weight normalization causes the Spearman correlation to drop to 0.00. However, the experimental data shows that for the best-performing Transformer model, the correlation drops from 0.8787 to 0.5941, and for the LSTM model, it drops from 0.795 to -0.0921. The value 0.00 is completely fabricated to exaggerate the impact of the ablation.","Weight normalization is essential: without it, Spearman correlation drops from 0.88 to 0.00, as raw weight magnitudes vary dramatically across configurations.",Faked Experimental Results
gemini-3.1-pro-preview,iclr2025_wsl,Faked Experimental Results,"The paper fabricates the per-dataset Spearman correlation scores for MNIST and Fashion-MNIST in Table 1 and the text. It claims MNIST achieves ρ = 0.21 and Fashion-MNIST achieves ρ = 0.40. However, the experimental data and VLM analysis indicate that MNIST achieves a high correlation (~0.87) and Fashion-MNIST achieves a strongly negative correlation (~-0.4). The values 0.21 and 0.40 were faked to support the narrative that the model struggles with within-dataset ranking.","Per-dataset correlations are substantially lower: MNIST achieves only ρ = 0.21 and Fashion-MNIST ρ = 0.40... Only CIFAR-10, with its broader accuracy distribution, achieves reasonable within-dataset correlation (ρ = 0.86).",Faked Experimental Results
gpt-5.4,iclr2025_bi_align,Nonexistent Citations,"The paper contains placeholder citations instead of real references throughout the introduction, related work, methods, experiments, and limitations. The reference section is empty, so the cited works cannot be verified and effectively do not exist in the paper. This includes claims about sycophancy, representational overrides, DPO mitigation, adaptive reasoning trajectories, bidirectional alignment, co-alignment, REINFORCE, and dataset citations.","Examples from the paper: ""LLMs trained with reinforcement learning from human feedback (RLHF) exhibit sycophancy—agreeing with users even when factually incorrect ( **??** ).""; ""Current mitigation approaches focus on making AI more truthful through Direct Preference Optimization (DPO) ... ( **?** )""; ""CCD’s strategy selection network maps context features to a distribution over strategies, trained via REINFORCE ( **?** ).""; ""We evaluate on TruthfulQA ( **?** ) for factual errors, ARC-Challenge ( **?** ), and CommonsenseQA ( **?** ).""; the paper ends with ""REFERENCES"" but lists no references.",Nonexistent Citations
gpt-5.4,iclr2025_bi_align,Hallucinated Methodology,"The paper claims CCD includes a learned receptivity prediction component and emphasizes conclusions about its ablation, but the provided code never uses the receptivity predictor in strategy selection, training, or evaluation. The model defines a `receptivity_predictor` module, but all decisions are made solely by `strategy_net`, and user acceptance is simulated directly from a hand-coded effectiveness matrix plus confidence/difficulty. Thus the claimed methodology overstates the role of receptivity prediction.","Paper claim: ""Ablation studies ... show that gains stem primarily from context-aware strategy selection and stochastic exploration rather than sophisticated receptivity prediction"" and ""receptivity prediction provides essentially no benefit"".
Code: in `stage_3_best_solution_823ee17b8cce4f5ca898687e8c18054a.py`, `class CCDModel` defines `self.receptivity_predictor = nn.Sequential(...)`, but `forward` returns only `self.strategy_net(x)`, `select_strategy` uses only `logits = self.forward(x)`, and training/evaluation call `simulate_user_response(...)` directly without invoking `receptivity_predictor` anywhere.",Hallucinated Methodology
gpt-5.4,iclr2025_bi_align,Hallucinated Methodology,"The paper states that user acceptance probability is modeled by a specific logistic equation with parameters β0, β1, β2, β3, but the implementation does not use this model. Instead, the code computes receptivity with a different hard-coded affine formula and clipping, then samples acceptance from it. The reported mathematical form therefore does not match the actual methodology.","Paper: ""User acceptance probability is modeled as P (accept) = σ ( β0+ β1 ·Ec,s−β 2 · ( α− 0 . 5)+ β 3 ·d ).""
Code: `receptivity = np.clip(0.5 + base_effectiveness * 0.4 - confidence_penalty + difficulty_bonus, 0.1, 0.95)` followed by `accepts = np.random.random() < receptivity` in `simulate_user_response`.",Hallucinated Methodology
gpt-5.4,iclr2025_bi_align,Hallucinated Methodology,"The paper describes CommonsenseQA as evaluating 'preference-based disagreements' and discusses contexts including value conflict and preference mismatch, but the code maps CommonsenseQA entirely to `context_type = 3` (preference_mismatch) and never evaluates any `value_conflict` examples (`context_type = 2`). Thus the claimed four-context setup is not actually exercised in experiments, and the dataset-context mapping is overstated or mislabeled.","Paper: ""Each interaction is characterized by context type c ∈ { factual error, reasoning flaw, value conflict, preference mismatch }"" and ""We evaluate on ... CommonsenseQA ( **?** ) for preference-based disagreements"".
Code: `process_commonsenseqa(...): ... ""context_type"": 3` and there is no dataset processing function assigning `context_type: 2`; nevertheless `EFFECTIVENESS_MATRIX` has 4 rows including value conflict.",Hallucinated Methodology
gpt-5.4,iclr2025_bi_align,Mathematical Errors,"The paper defines CDES as a combination of strategy-context alignment, acceptance-weighted accuracy, and trust preservation with weights summing to 1. However, the supplementary table reports trust values above 1 (e.g., 1.120, 1.132) and even values above 1 for random/blunt, making the final CDES not a normalized score in [0,1]. This is mathematically inconsistent with how the score is presented as a bounded 'score' and with main-text values like 0.947 being compared as if on a conventional unit scale.","Paper: ""The Calibrated Disagreement Effectiveness Score (CDES) combines strategy-context alignment (40%), acceptance-weighted accuracy (40%), and trust preservation (20%).""
Supplementary Table 1 reports trust values such as `1.120`, `1.132`, `1.106`, and the code computes `trust_ratios.append((baseline_trust + trust_delta) / baseline_trust)`, which can exceed 1.0; then `cdes = 0.4 * strategy_match_rate + 0.4 * weighted_accuracy + 0.2 * trust_preservation`.",Mathematical Errors
gpt-5.4,iclr2025_bi_align,Faked Experimental Results,"Several headline numbers in the paper do not match the provided experiment outputs. The paper reports overall CCD CDES of 0.947, blunt 0.561, random 0.586, and per-dataset CCD values 0.89–0.97, but the main stage-3 code and summaries show different values (e.g., overall CCD 0.9467 in research_summary, 0.9121 or 0.9235 or 0.9339 in ablations depending on experiment). The paper presents one coherent final result set without identifying which code run produced it, and those exact values are not supported by the supplied implementation artifacts.","Paper: ""CCD achieves overall CDES of 0.947, outperforming sycophantic (0.200), blunt (0.561), and random (0.586) baselines."" and Figure 1 caption: ""CCD (0.947) substantially outperforms all baselines."" 
Code summaries: `research_summary.json` gives `CCD CDES Score ... Overall 0.9467`; `ablation_summary.json` entries report different 'overall' CCD values such as `0.9121`, `0.9188`, `0.9235`, `0.9339`. No provided code artifact exactly supports the paper's consolidated 0.947/0.561/0.586 result set as the stated final experiment.",Faked Experimental Results
gpt-5.4,iclr2025_bi_align,Faked Experimental Results,"The paper claims specific ablation conclusions and deltas that are not supported by the code outputs. In particular, it states multinomial sampling and temperature exploration each contribute over 0.35 CDES and that context features contribute +0.29, but the supplied ablation artifacts show differing values, contexts, and inconsistent overall scores across runs. These precise attribution numbers appear synthesized rather than directly traceable to one executed experiment.","Paper: ""Ablation studies (Figure 2) reveal that stochastic exploration mechanisms are essential: multinomial sampling and temperature exploration each contribute over 0.35 CDES improvement... Context features provide substantial benefit (∆=+0.29)... receptivity prediction provides essentially no benefit (∆=-0.01).""
Available code artifacts: `ablation_summary.json` for ""No Temperature-Based Exploration"" reports `CDES Difference (Baseline - Ablation)` overall `0.3643`; for ""No Context-Aware Input Features"" it reports final CDES `0.9121` vs `0.6238`, a drop of `0.2883`; for ""No Receptivity Predictor Module"" overall scores are `0.9121` vs `0.9188`, which contradicts the paper's implication that the full final result is 0.947 while also using the same ablation deltas.",Faked Experimental Results
gpt-5.4,iclr2025_buildingtrust,Nonexistent Citations,"The paper cites multiple arXiv papers from 2025 that cannot be verified from the provided codebase and are highly likely fabricated or at least not grounded in the actual experiment. In particular, the references to Rathi et al. (2025), Zhang et al. (2025), and likely Zhou et al. (2023) as a proceedings paper without venue details appear unsupported. The paper relies on these citations in the introduction and related work, but no evidence is provided that they are real, and some arXiv IDs are future-dated/suspicious.","References section: ""Neil Rathi, Dan Jurafsky, and Kaitlyn Zhou. Humans overrely on overconfident language models, across languages. ArXiv, abs/2507.06306, 2025."" and ""Glenn Zhang, Treasure Mayowa, Jason Fan, Yicheng Fu, Aaron Sandoval, Sean O’Brien, and Kevin Zhu. Direct confidence alignment: Aligning verbalized confidence with internal confidence in large language models. ArXiv, abs/2512.11998, 2025.""",Nonexistent Citations
